[ {
  "schemaVersion" : "trace-link-domain-primitive-result-v1",
  "calculationVersion" : "trace-link-native-primitives-v1",
  "observation" : {
    "schemaVersion" : "trace-link-domain-window-v1",
    "datasetId" : "trace-link-bounded-fixture-v1",
    "synthetic" : true,
    "sourceId" : "trace-link-native-primitives-v1",
    "scopeNamespace" : "trace-link-reference-v1",
    "catalogueVersion" : "trace-link-geography-v2",
    "topologyVersion" : "trace-link-links-v1",
    "policyVersion" : "trace-link-kpi-v1",
    "domain" : "TRANSPORT",
    "scopeId" : "chi-orh",
    "scopeType" : "LINK_DIRECTION",
    "linkId" : "chi-orh",
    "directionId" : "a-to-b",
    "windowStart" : "2026-09-10T09:00:00Z",
    "windowEnd" : "2026-09-10T09:05:00Z",
    "sourceResolutionSeconds" : 300,
    "emittedAt" : "2026-09-10T09:05:00Z",
    "revision" : 0,
    "finalized" : true,
    "metricId" : "transport.traffic",
    "population" : "Directional carried bits / valid elapsed seconds / 1e9; time-weight each observed rate.",
    "unit" : "GBPS",
    "aggregationType" : "TIME_WEIGHTED_MEAN",
    "quality" : "INSUFFICIENT_EVIDENCE",
    "coverage" : 1,
    "primitives" : {
      "weightedSum" : 3504.293400,
      "validSeconds" : 300
    },
    "transport" : {
      "trafficGbps" : 11.680978,
      "effectiveCapacityGbps" : 20,
      "validFrom" : "2026-09-10T09:00:00Z",
      "validTo" : "2026-09-10T09:05:00Z"
    },
    "eventId" : "4758334e8d60ab4789cf4efe5eafda977628d043c309058c70f3504d22c4ccf0"
  },
  "availability" : "APPROXIMATION",
  "referenceLimitations" : "Reference rate sample assumes 300 valid seconds and A-to-B direction; byte deltas/reset epochs absent.",
  "qualification" : "Native arithmetic only; source quality and source coverage are unknown.",
  "sourceQuality" : null,
  "sourceCoverage" : null,
  "coverageBasis" : "NATIVE_SLOT_PRESENCE; observation.coverage is not source coverage",
  "validityAssumption" : "300 seconds per native slot; not source-provided temporal validity.",
  "referenceOnly" : false,
  "procedureEligibility" : "NOT_APPLICABLE",
  "weightingBasis" : null,
  "provenance" : {
    "manifestSha256" : "48017fa7ccf83883c4975b4a175c6d9f6a9dbb491da8b8faa49c724246e6f775",
    "generatorVersion" : "reference-1.0",
    "seed" : 42,
    "naturalId" : "221b2190c5a69abcf150f37b9a83b5f19351da1d60c3a2caf6f421c44440fde3",
    "sourceFile" : "link_kpi_5m.csv",
    "sourceRowNumber" : 1,
    "sourceRowSha256" : "b9627b4805bc045ce8336b3d4012d8ef1cd5a259a0045aab2d7f9827686c34a0"
  },
  "value" : 11.680978,
  "nullReason" : "NONE"
}, {
  "schemaVersion" : "trace-link-domain-primitive-result-v1",
  "calculationVersion" : "trace-link-native-primitives-v1",
  "observation" : {
    "schemaVersion" : "trace-link-domain-window-v1",
    "datasetId" : "trace-link-bounded-fixture-v1",
    "synthetic" : true,
    "sourceId" : "trace-link-native-primitives-v1",
    "scopeNamespace" : "trace-link-reference-v1",
    "catalogueVersion" : "trace-link-geography-v2",
    "topologyVersion" : "trace-link-links-v1",
    "policyVersion" : "trace-link-kpi-v1",
    "domain" : "TRANSPORT",
    "scopeId" : "chi-orh",
    "scopeType" : "LINK_DIRECTION",
    "linkId" : "chi-orh",
    "directionId" : "a-to-b",
    "windowStart" : "2026-09-10T09:00:00Z",
    "windowEnd" : "2026-09-10T09:05:00Z",
    "sourceResolutionSeconds" : 300,
    "emittedAt" : "2026-09-10T09:05:00Z",
    "revision" : 0,
    "finalized" : true,
    "metricId" : "transport.effectiveCapacity",
    "population" : "Operational directional capacity valid at the endpoint; retain changes, never substitute nominal capacity after reduction.",
    "unit" : "GBPS",
    "aggregationType" : "SNAPSHOT_LAST",
    "quality" : "INSUFFICIENT_EVIDENCE",
    "coverage" : 1,
    "primitives" : {
      "value" : 20,
      "snapshotAt" : "2026-09-10T09:00:00Z"
    },
    "transport" : {
      "trafficGbps" : 11.680978,
      "effectiveCapacityGbps" : 20,
      "validFrom" : "2026-09-10T09:00:00Z",
      "validTo" : "2026-09-10T09:05:00Z"
    },
    "eventId" : "74051d07547fbe15c306a417a73879f6f291be6f2ca543cf75f8dd2bfe133b71"
  },
  "availability" : "APPROXIMATION",
  "referenceLimitations" : "Slot-level gauge available; exact validity intervals/source authority absent.",
  "qualification" : "Native arithmetic only; source quality and source coverage are unknown.",
  "sourceQuality" : null,
  "sourceCoverage" : null,
  "coverageBasis" : "NATIVE_SLOT_PRESENCE; observation.coverage is not source coverage",
  "validityAssumption" : "300 seconds per native slot; not source-provided temporal validity.",
  "referenceOnly" : false,
  "procedureEligibility" : "NOT_APPLICABLE",
  "weightingBasis" : null,
  "provenance" : {
    "manifestSha256" : "48017fa7ccf83883c4975b4a175c6d9f6a9dbb491da8b8faa49c724246e6f775",
    "generatorVersion" : "reference-1.0",
    "seed" : 42,
    "naturalId" : "221b2190c5a69abcf150f37b9a83b5f19351da1d60c3a2caf6f421c44440fde3",
    "sourceFile" : "link_kpi_5m.csv",
    "sourceRowNumber" : 1,
    "sourceRowSha256" : "b9627b4805bc045ce8336b3d4012d8ef1cd5a259a0045aab2d7f9827686c34a0"
  },
  "value" : 20,
  "nullReason" : "NONE"
}, {
  "schemaVersion" : "trace-link-domain-primitive-result-v1",
  "calculationVersion" : "trace-link-native-primitives-v1",
  "observation" : {
    "schemaVersion" : "trace-link-domain-window-v1",
    "datasetId" : "trace-link-bounded-fixture-v1",
    "synthetic" : true,
    "sourceId" : "trace-link-native-primitives-v1",
    "scopeNamespace" : "trace-link-reference-v1",
    "catalogueVersion" : "trace-link-geography-v2",
    "topologyVersion" : "trace-link-links-v1",
    "policyVersion" : "trace-link-kpi-v1",
    "domain" : "TRANSPORT",
    "scopeId" : "chi-orh",
    "scopeType" : "LINK_DIRECTION",
    "linkId" : "chi-orh",
    "directionId" : "a-to-b",
    "windowStart" : "2026-09-10T09:00:00Z",
    "windowEnd" : "2026-09-10T09:05:00Z",
    "sourceResolutionSeconds" : 300,
    "emittedAt" : "2026-09-10T09:05:00Z",
    "revision" : 0,
    "finalized" : true,
    "metricId" : "transport.link.utilization",
    "population" : "100 * directional carried traffic / contemporaneous positive effective capacity, averaged over valid seconds.",
    "unit" : "PERCENT",
    "aggregationType" : "TIME_WEIGHTED_MEAN",
    "quality" : "INSUFFICIENT_EVIDENCE",
    "coverage" : 1,
    "primitives" : {
      "weightedSum" : 17521.467000,
      "validSeconds" : 300
    },
    "transport" : {
      "trafficGbps" : 11.680978,
      "effectiveCapacityGbps" : 20,
      "validFrom" : "2026-09-10T09:00:00Z",
      "validTo" : "2026-09-10T09:05:00Z"
    },
    "eventId" : "7465469f94668ca56e99695a21c067ec1d9a97a98526ddbc50fbe9363856c920"
  },
  "availability" : "APPROXIMATION",
  "referenceLimitations" : "Reference endpoint ratio supported; mean requires explicit 300-second validity assumption. Reference linkSeries displays peak, not mean.",
  "qualification" : "Native arithmetic only; source quality and source coverage are unknown.",
  "sourceQuality" : null,
  "sourceCoverage" : null,
  "coverageBasis" : "NATIVE_SLOT_PRESENCE; observation.coverage is not source coverage",
  "validityAssumption" : "300 seconds per native slot; not source-provided temporal validity.",
  "referenceOnly" : false,
  "procedureEligibility" : "NOT_APPLICABLE",
  "weightingBasis" : null,
  "provenance" : {
    "manifestSha256" : "48017fa7ccf83883c4975b4a175c6d9f6a9dbb491da8b8faa49c724246e6f775",
    "generatorVersion" : "reference-1.0",
    "seed" : 42,
    "naturalId" : "221b2190c5a69abcf150f37b9a83b5f19351da1d60c3a2caf6f421c44440fde3",
    "sourceFile" : "link_kpi_5m.csv",
    "sourceRowNumber" : 1,
    "sourceRowSha256" : "b9627b4805bc045ce8336b3d4012d8ef1cd5a259a0045aab2d7f9827686c34a0"
  },
  "value" : 58.404890,
  "nullReason" : "NONE"
}, {
  "schemaVersion" : "trace-link-domain-primitive-result-v1",
  "calculationVersion" : "trace-link-native-primitives-v1",
  "observation" : {
    "schemaVersion" : "trace-link-domain-window-v1",
    "datasetId" : "trace-link-bounded-fixture-v1",
    "synthetic" : true,
    "sourceId" : "trace-link-native-primitives-v1",
    "scopeNamespace" : "trace-link-reference-v1",
    "catalogueVersion" : "trace-link-geography-v2",
    "topologyVersion" : "trace-link-links-v1",
    "policyVersion" : "trace-link-kpi-v1",
    "domain" : "TRANSPORT",
    "scopeId" : "chi-orh",
    "scopeType" : "LINK_DIRECTION",
    "linkId" : "chi-orh",
    "directionId" : "a-to-b",
    "windowStart" : "2026-09-10T09:00:00Z",
    "windowEnd" : "2026-09-10T09:05:00Z",
    "sourceResolutionSeconds" : 300,
    "emittedAt" : "2026-09-10T09:05:00Z",
    "revision" : 0,
    "finalized" : true,
    "metricId" : "transport.rtt.snapshot",
    "population" : "Illustrative RTT scalar at selected link endpoint observation.",
    "unit" : "MILLISECONDS",
    "aggregationType" : "SNAPSHOT_LAST",
    "quality" : "INSUFFICIENT_EVIDENCE",
    "coverage" : 1,
    "primitives" : {
      "value" : 16.350678,
      "snapshotAt" : "2026-09-10T09:00:00Z"
    },
    "transport" : {
      "trafficGbps" : 11.680978,
      "effectiveCapacityGbps" : 20,
      "validFrom" : "2026-09-10T09:00:00Z",
      "validTo" : "2026-09-10T09:05:00Z"
    },
    "eventId" : "436412b604bf9605dcfff730c5f6fd343d18d4f08ece1c8b20cabe4875bbf282"
  },
  "availability" : "APPROXIMATION",
  "referenceLimitations" : "Probe/path identity absent; series uses worst-scoped RTT, not probe-weighted mean.",
  "qualification" : "Native arithmetic only; source quality and source coverage are unknown.",
  "sourceQuality" : null,
  "sourceCoverage" : null,
  "coverageBasis" : "NATIVE_SLOT_PRESENCE; observation.coverage is not source coverage",
  "validityAssumption" : "300 seconds per native slot; not source-provided temporal validity.",
  "referenceOnly" : false,
  "procedureEligibility" : "NOT_APPLICABLE",
  "weightingBasis" : null,
  "provenance" : {
    "manifestSha256" : "48017fa7ccf83883c4975b4a175c6d9f6a9dbb491da8b8faa49c724246e6f775",